{
  "id": "backend-experiments",
  "name": "Backend Experiments",
  "tagline": "Node.js backend experimentation with MongoDB and Express",
  "description": "",
  "category": "project",
  "subcategory": "backend",
  "tech_stack": [
    "node",
    "mongodb",
    "express"
  ],
  "source_type": "local_code",
  "local_path": "/Users/macbookpro/Documents/fuckedupcode",
  "has_existing_git": true,
  "github_repo": null,
  "active_periods": [
    {
      "start": "2025-03-13",
      "end": "2025-03-13",
      "intensity": "medium"
    }
  ],
  "ai_providers_used": [
    "chatgpt"
  ],
  "proof": {
    "filesystem_timestamps": true,
    "ai_export_available": false,
    "surge_deploys": false,
    "confidence": "high"
  },
  "metrics": {
    "file_count": 85,
    "extensions": {
      "": 5,
      ".conf": 3,
      ".sh": 3,
      ".js": 51,
      ".md": 1,
      ".json": 8,
      ".yml": 1,
      ".example": 1,
      ".html": 3,
      ".xml": 2,
      ".txt": 3,
      ".css": 2,
      ".map": 2
    }
  },
  "portfolio_priority": 4,
  "content_angles": [
    "Backend API experiments and server monitoring"
  ],
  "tags": [
    "backend",
    "node",
    "mongodb",
    "api",
    "experiments"
  ]
}