{
  "id": "research-general",
  "name": "Research Collection",
  "tagline": "Podcast analysis, AI video tools research, and general investigations",
  "description": "",
  "category": "research",
  "subcategory": "general-research",
  "tech_stack": [],
  "source_type": "local_code",
  "local_path": "/Users/macbookpro/Documents/research",
  "has_existing_git": false,
  "github_repo": null,
  "active_periods": [
    {
      "start": "2025-09-02",
      "end": "2026-03-21",
      "intensity": "low"
    }
  ],
  "ai_providers_used": [
    "chatgpt",
    "claude"
  ],
  "proof": {
    "filesystem_timestamps": true,
    "ai_export_available": false,
    "surge_deploys": false,
    "confidence": "medium"
  },
  "metrics": {
    "file_count": 8,
    "extensions": {
      ".html": 4,
      "": 1,
      ".md": 1,
      ".txt": 1,
      ".pages": 1
    }
  },
  "portfolio_priority": 3,
  "content_angles": [
    "Multi-topic research spanning AI tools, podcasts, and media analysis"
  ],
  "tags": [
    "research",
    "podcasts",
    "ai-tools",
    "analysis"
  ]
}