{
  "id": "meta-business-system",
  "name": "Meta Business System",
  "tagline": "Market research and opportunity discovery platform with SQLite, data viz, and social APIs",
  "description": "",
  "category": "project",
  "subcategory": "business-intelligence",
  "tech_stack": [
    "python",
    "sqlite",
    "matplotlib",
    "tweepy",
    "praw"
  ],
  "source_type": "local_code",
  "local_path": "/Users/macbookpro/Documents/meta business system",
  "has_existing_git": false,
  "github_repo": null,
  "active_periods": [
    {
      "start": "2025-04-06",
      "end": "2025-05-05",
      "intensity": "high"
    }
  ],
  "ai_providers_used": [
    "chatgpt",
    "cursor"
  ],
  "proof": {
    "filesystem_timestamps": true,
    "ai_export_available": false,
    "surge_deploys": false,
    "confidence": "high"
  },
  "metrics": {
    "file_count": 358,
    "extensions": {
      "": 8,
      ".json": 10,
      ".md": 32,
      ".rtf": 2,
      ".js": 2,
      ".txt": 15,
      ".py": 209,
      ".ini": 1,
      ".yaml": 1,
      ".toml": 1,
      ".yml": 1,
      ".example": 1,
      ".mdx": 20,
      ".ipynb": 1,
      ".log": 50,
      ".db": 4
    }
  },
  "portfolio_priority": 2,
  "content_angles": [
    "Automated market research: scraping Reddit, Twitter, and Google for business opportunities",
    "SQLite-backed intelligence platform with data visualization",
    "From idea to market validation in minutes via AI-driven research"
  ],
  "tags": [
    "market-research",
    "business-intelligence",
    "data-viz",
    "social-api",
    "automation",
    "sqlite"
  ]
}