{
  "id": "mm-eas-services",
  "name": "EAS (Engineering Agency Services)",
  "tagline": "Full agency vertical: website, legal, outreach, playbooks, case studies, tech stack",
  "description": "",
  "category": "project",
  "subcategory": "printmaxx-subsystem",
  "tech_stack": [
    "python",
    "html"
  ],
  "source_type": "local_code",
  "local_path": "/Users/macbookpro/Documents/p/PRINTMAXX_STARTER_KITttttt",
  "has_existing_git": false,
  "github_repo": null,
  "active_periods": [
    {
      "start": "2025-03-01",
      "end": "2026-03-22",
      "intensity": "high"
    }
  ],
  "ai_providers_used": [
    "claude",
    "cursor"
  ],
  "proof": {
    "filesystem_timestamps": true,
    "ai_export_available": false,
    "surge_deploys": false,
    "confidence": "high"
  },
  "metrics": {
    "parent_project": "printmaxx-starter-kit"
  },
  "portfolio_priority": 2,
  "content_angles": [
    "Full agency vertical: website, legal, outreach, playbooks, case studies, tech stack"
  ],
  "tags": [
    "printmaxx"
  ]
}